{
  "servingsBase": 0.4,
  "servingsPerBowl": 0.3,
  "ageModifiers": {
    "toddler": 0.6,
    "child": 0.85,
    "teen": 1,
    "adult": 1,
    "senior": 0.9
  },
  "moreProteinFactor": 1.2,
  "moreVegFactor": 1.2,
  "sublinearExponent": 0.8,
  "gramsRawRicePerBowl": {
    "small": 35,
    "medium": 40,
    "large": 50
  },
  "riceRoundingGrams": 10,
  "riceIngredientId": "gao",
  "defaultBowlsPerMeal": {
    "toddler": 1,
    "child": 1.5,
    "teen": 2.5,
    "adult": 2,
    "senior": 1.5
  },
  "minBowlsPerMeal": 0.5,
  "maxBowlsPerMeal": 5,
  "bowlsStep": 0.5
}
